{
  "$schema":"https://json-schema.org/draft/2020-12/schema","$id":"https://novel-production-os.local/schemas/soft-holdout-report.v1.schema.json",
  "type":"object","additionalProperties":false,"required":["schema_version","threshold_bundle_hash","labels_hash","split_hash","features_hash","one_shot","holdout_count","matrices","totals","results","receipt_hash"],
  "properties":{"schema_version":{"const":"soft-holdout-report.v1"},"threshold_bundle_hash":{"$ref":"#/$defs/hash"},"labels_hash":{"$ref":"#/$defs/hash"},"split_hash":{"$ref":"#/$defs/hash"},"features_hash":{"$ref":"#/$defs/hash"},"one_shot":{"const":true},"holdout_count":{"const":24},"matrices":{"type":"array","minItems":3,"maxItems":3,"items":{"$ref":"#/$defs/matrix"}},"totals":{"$ref":"#/$defs/counts"},"results":{"type":"array","minItems":24,"maxItems":24,"items":{"$ref":"#/$defs/result"}},"receipt_hash":{"$ref":"#/$defs/hash"}},
  "$defs":{"hash":{"type":"string","pattern":"^sha256:[0-9a-f]{64}$"},"counts":{"type":"object","additionalProperties":false,"required":["tp","fp","tn","fn"],"properties":{"tp":{"type":"integer"},"fp":{"type":"integer"},"tn":{"type":"integer"},"fn":{"type":"integer"}}},"matrix":{"type":"object","additionalProperties":false,"required":["detector_id","sample_count","tp","fp","tn","fn","precision","recall","balanced_accuracy"],"properties":{"detector_id":{"enum":["persona_drift","trope_repeat","word_count_cheat"]},"sample_count":{"const":8},"tp":{"type":"integer"},"fp":{"type":"integer"},"tn":{"type":"integer"},"fn":{"type":"integer"},"precision":{"type":["number","null"]},"recall":{"type":["number","null"]},"balanced_accuracy":{"type":["number","null"]}}},"result":{"type":"object","additionalProperties":false,"required":["sample_id","detector_id","feature_value","threshold","expected_detected","actual_detected","outcome"],"properties":{"sample_id":{"type":"string"},"detector_id":{"enum":["persona_drift","trope_repeat","word_count_cheat"]},"feature_value":{"type":"number"},"threshold":{"type":"number"},"expected_detected":{"type":"boolean"},"actual_detected":{"type":"boolean"},"outcome":{"enum":["tp","fp","tn","fn"]}}}}
}
