{"features_hash":"sha256:b724b35c1dfb321f44718ad01373b1c6117374af32f26ea3e5dbd4b2679f1aa6","holdout_count":24,"labels_hash":"sha256:d8b334b898fd2b42392169da1ce450367e2a8b3a24d096e1964a529d9d969ce0","matrices":[{"balanced_accuracy":1.0,"detector_id":"persona_drift","fn":0,"fp":0,"precision":1.0,"recall":1.0,"sample_count":8,"tn":4,"tp":4},{"balanced_accuracy":1.0,"detector_id":"trope_repeat","fn":0,"fp":0,"precision":1.0,"recall":1.0,"sample_count":8,"tn":4,"tp":4},{"balanced_accuracy":1.0,"detector_id":"word_count_cheat","fn":0,"fp":0,"precision":1.0,"recall":1.0,"sample_count":8,"tn":4,"tp":4}],"one_shot":true,"receipt_hash":"sha256:a22a6410fc9be0545955c12398d49f2156380d74d951456c88431765ce3e5594","results":[{"actual_detected":true,"detector_id":"persona_drift","expected_detected":true,"feature_value":1.0,"outcome":"tp","sample_id":"soft_persona_drift_23","threshold":1.0},{"actual_detected":true,"detector_id":"persona_drift","expected_detected":true,"feature_value":1.0,"outcome":"tp","sample_id":"soft_persona_drift_24","threshold":1.0},{"actual_detected":true,"detector_id":"persona_drift","expected_detected":true,"feature_value":1.0,"outcome":"tp","sample_id":"soft_persona_drift_25","threshold":1.0},{"actual_detected":true,"detector_id":"persona_drift","expected_detected":true,"feature_value":1.0,"outcome":"tp","sample_id":"soft_persona_drift_26","threshold":1.0},{"actual_detected":false,"detector_id":"persona_drift","expected_detected":false,"feature_value":0.0,"outcome":"tn","sample_id":"soft_persona_drift_27","threshold":1.0},{"actual_detected":false,"detector_id":"persona_drift","expected_detected":false,"feature_value":0.0,"outcome":"tn","sample_id":"soft_persona_drift_28","threshold":1.0},{"actual_detected":false,"detector_id":"persona_drift","expected_detected":false,"feature_value":0.0,"outcome":"tn","sample_id":"soft_persona_drift_29","threshold":1.0},{"actual_detected":false,"detector_id":"persona_drift","expected_detected":false,"feature_value":0.0,"outcome":"tn","sample_id":"soft_persona_drift_30","threshold":1.0},{"actual_detected":true,"detector_id":"trope_repeat","expected_detected":true,"feature_value":5.0,"outcome":"tp","sample_id":"soft_trope_repeat_23","threshold":2.0},{"actual_detected":true,"detector_id":"trope_repeat","expected_detected":true,"feature_value":6.0,"outcome":"tp","sample_id":"soft_trope_repeat_24","threshold":2.0},{"actual_detected":true,"detector_id":"trope_repeat","expected_detected":true,"feature_value":2.0,"outcome":"tp","sample_id":"soft_trope_repeat_25","threshold":2.0},{"actual_detected":true,"detector_id":"trope_repeat","expected_detected":true,"feature_value":3.0,"outcome":"tp","sample_id":"soft_trope_repeat_26","threshold":2.0},{"actual_detected":false,"detector_id":"trope_repeat","expected_detected":false,"feature_value":0.0,"outcome":"tn","sample_id":"soft_trope_repeat_27","threshold":2.0},{"actual_detected":false,"detector_id":"trope_repeat","expected_detected":false,"feature_value":0.0,"outcome":"tn","sample_id":"soft_trope_repeat_28","threshold":2.0},{"actual_detected":false,"detector_id":"trope_repeat","expected_detected":false,"feature_value":0.0,"outcome":"tn","sample_id":"soft_trope_repeat_29","threshold":2.0},{"actual_detected":false,"detector_id":"trope_repeat","expected_detected":false,"feature_value":0.0,"outcome":"tn","sample_id":"soft_trope_repeat_30","threshold":2.0},{"actual_detected":true,"detector_id":"word_count_cheat","expected_detected":true,"feature_value":0.6231884057971014,"outcome":"tp","sample_id":"soft_word_count_cheat_23","threshold":0.5915492957746479},{"actual_detected":true,"detector_id":"word_count_cheat","expected_detected":true,"feature_value":0.624113475177305,"outcome":"tp","sample_id":"soft_word_count_cheat_24","threshold":0.5915492957746479},{"actual_detected":true,"detector_id":"word_count_cheat","expected_detected":true,"feature_value":0.625,"outcome":"tp","sample_id":"soft_word_count_cheat_25","threshold":0.5915492957746479},{"actual_detected":true,"detector_id":"word_count_cheat","expected_detected":true,"feature_value":0.6258503401360545,"outcome":"tp","sample_id":"soft_word_count_cheat_26","threshold":0.5915492957746479},{"actual_detected":false,"detector_id":"word_count_cheat","expected_detected":false,"feature_value":0.0,"outcome":"tn","sample_id":"soft_word_count_cheat_27","threshold":0.5915492957746479},{"actual_detected":false,"detector_id":"word_count_cheat","expected_detected":false,"feature_value":0.0,"outcome":"tn","sample_id":"soft_word_count_cheat_28","threshold":0.5915492957746479},{"actual_detected":false,"detector_id":"word_count_cheat","expected_detected":false,"feature_value":0.0,"outcome":"tn","sample_id":"soft_word_count_cheat_29","threshold":0.5915492957746479},{"actual_detected":false,"detector_id":"word_count_cheat","expected_detected":false,"feature_value":0.0,"outcome":"tn","sample_id":"soft_word_count_cheat_30","threshold":0.5915492957746479}],"schema_version":"soft-holdout-report.v1","split_hash":"sha256:faa81c9a56c613b4bd9da57f089d1bf68c9e5637b104023af52e2aec3f8b7729","threshold_bundle_hash":"sha256:c7f35608853f6a784df4ddf59e2c7b01449e4f23e2829e67650b55a1aee0963e","totals":{"fn":0,"fp":0,"tn":12,"tp":12}}